[
  {
    "station_id": "sh_stn_00107",
    "names": {"zh-Hans": "南京东路", "zh-Hant": "南京東路", "en": "East Nanjing Rd"},
    "romanization": {"pinyin": "nán jīng dōng lù", "pinyin_plain": "nanjing donglu"},
    "coordinate": {"lat": 31.2389, "lng": 121.4805, "crs": "WGS84", "precision_m": 20},
    "station_group_id": "sh_stn_grp_0031",
    "is_transfer_hub": true,
    "vertical_complexity": "multi_level",
    "lines": [
      {"code": "2", "name_en": "Line 2 (Green)", "name_zh": "2 号线", "color_hex": "#00A650",
       "directions": [
         {"name_en": "Towards Pudong Int'l Airport", "name_zh": "往浦东国际机场方向", "terminal_station_id": "sh_stn_00002"},
         {"name_en": "Towards East Xujing", "name_zh": "往徐泾东方向", "terminal_station_id": "sh_stn_00003"}
       ]},
      {"code": "10", "name_en": "Line 10 (Lilac)", "name_zh": "10 号线", "color_hex": "#C6AFD4",
       "directions": [
         {"name_en": "Towards Hangzhong Rd", "name_zh": "往航中路方向", "terminal_station_id": "sh_stn_00021"}
       ]}
    ],
    "access_points": [
      {"access_no": "2", "kind": "entrance", "name_zh": "2号口", "name_en": "Entrance 2",
       "coordinate": {"lat": 31.2392, "lng": 121.4811, "crs": "WGS84", "precision_m": 15},
       "landmark_desc_zh": "南京东路步行街方向", "landmark_desc_en": "Towards Nanjing Road Pedestrian Street",
       "is_barrier_free": true, "has_escalator": true, "is_open": true},
      {"access_no": "7", "kind": "exit", "name_zh": "7号口", "name_en": "Exit 7",
       "coordinate": {"lat": 31.2381, "lng": 121.4798, "crs": "WGS84", "precision_m": 15},
       "landmark_desc_zh": "外滩方向", "landmark_desc_en": "Towards The Bund",
       "is_barrier_free": false, "has_escalator": true, "is_open": true}
    ],
    "interior_transfers": [
      {"from_line_code": "2", "to_line_code": "10", "walking_distance_meters": 320, "minutes_min": 6, "minutes_max": 8,
       "is_in_station": true, "note_zh": "建议走站内扶梯", "note_en": "Take indoor escalators",
       "vertical_gap_note_zh": "站厅到站台高差较大", "is_barrier_free": false}
    ],
    "coverage": {"tier": "core_hub", "completeness": "full"},
    "provenance": {"source": "manual", "updated_at": 1791763200, "reviewed_by": "data-ops",
                   "field_verified_at": {"access_points": 1791763200, "interior_transfers": 1791504000}}
  },
  {
    "station_id": "sh_stn_00214",
    "names": {"zh-Hans": "人民广场", "zh-Hant": "人民廣場", "en": "People's Square"},
    "romanization": {"pinyin": "rén mín guǎng chǎng", "pinyin_plain": "renmin guangchang"},
    "coordinate": {"lat": 31.2340, "lng": 121.4750, "crs": "WGS84", "precision_m": 20},
    "station_group_id": "sh_stn_grp_0021",
    "is_transfer_hub": true,
    "vertical_complexity": "deep_multi_level",
    "lines": [
      {"code": "1", "name_en": "Line 1 (Red)", "name_zh": "1 号线", "color_hex": "#E4002B",
       "directions": [{"name_en": "Towards Xinzhuang", "name_zh": "往莘庄方向", "terminal_station_id": "sh_stn_00011"}]},
      {"code": "2", "name_en": "Line 2 (Green)", "name_zh": "2 号线", "color_hex": "#00A650",
       "directions": [{"name_en": "Towards East Xujing", "name_zh": "往徐泾东方向", "terminal_station_id": "sh_stn_00003"}]},
      {"code": "8", "name_en": "Line 8 (Blue)", "name_zh": "8 号线", "color_hex": "#0094D8",
       "directions": [{"name_en": "Towards Shendu Highway", "name_zh": "往沈杜公路方向", "terminal_station_id": "sh_stn_00031"}]}
    ],
    "access_points": [
      {"access_no": "7", "kind": "exit", "name_zh": "7号口", "name_en": "Exit 7",
       "coordinate": {"lat": 31.2321, "lng": 121.4743, "crs": "WGS84", "precision_m": 15},
       "landmark_desc_zh": "上海博物馆方向", "landmark_desc_en": "Towards Shanghai Museum",
       "is_barrier_free": true, "has_escalator": true, "is_open": true}
    ],
    "interior_transfers": [
      {"from_line_code": "2", "to_line_code": "1", "walking_distance_meters": 300, "minutes_min": 5, "minutes_max": 7,
       "is_in_station": true, "note_zh": "跟随站内换乘指引", "note_en": "Follow in-station transfer signs",
       "vertical_gap_note_zh": "跨站厅换乘", "is_barrier_free": true}
    ],
    "coverage": {"tier": "core_hub", "completeness": "full"},
    "provenance": {"source": "manual", "updated_at": 1791763200, "reviewed_by": "data-ops"}
  },
  {
    "station_id": "sh_stn_00108",
    "names": {"zh-Hans": "中山公园", "zh-Hant": "中山公園", "en": "Zhongshan Park"},
    "romanization": {"pinyin": "zhōng shān gōng yuán", "pinyin_plain": "zhongshan gongyuan"},
    "coordinate": {"lat": 31.2222, "lng": 121.4130, "crs": "WGS84", "precision_m": 30},
    "station_group_id": "sh_stn_grp_0008",
    "is_transfer_hub": true,
    "vertical_complexity": "multi_level",
    "lines": [
      {"code": "2", "name_en": "Line 2 (Green)", "name_zh": "2 号线", "color_hex": "#00A650", "directions": []},
      {"code": "3", "name_en": "Line 3 (Yellow)", "name_zh": "3 号线", "color_hex": "#FFD100", "directions": []}
    ],
    "access_points": [
      {"access_no": "5", "kind": "both", "name_zh": "5号口", "name_en": "Entrance 5",
       "coordinate": {"lat": 31.2225, "lng": 121.4120, "crs": "WGS84", "precision_m": 20},
       "landmark_desc_zh": "中山公园方向", "landmark_desc_en": "Towards Zhongshan Park",
       "is_barrier_free": true, "has_escalator": true, "is_open": true}
    ],
    "interior_transfers": [
      {"from_line_code": "2", "to_line_code": "3", "walking_distance_meters": 210, "minutes_min": 4, "minutes_max": 6,
       "is_in_station": true, "note_zh": "建议走站内扶梯", "note_en": "Take indoor escalators",
       "vertical_gap_note_zh": null, "is_barrier_free": true}
    ],
    "coverage": {"tier": "major", "completeness": "access_points_only"},
    "provenance": {"source": "manual", "updated_at": 1791763200, "reviewed_by": "data-ops"}
  }
]